{
   "$schema":"http://json-schema.org/draft-04/schema#",
   "type":"object",
   "id":"LeaveRequest",
   "properties":{  
      "id":{  
         "type":"string"
      },
      "createdOn":{  
         "type":"array",
         "items":{  
            "type":"integer"
         }
      },
      "modifiedOn":{  
         "type":"array",
         "items":{  
            "type":"integer"
         }
      },
      "approvals":{  
         "type":"array",
         "items":{  
            "type":"object",
            "id":"Approval",
            "properties":{  
               "remarks":{  
                  "type":"string"
               },
               "approvedBy":{  
                  "type":"string"
               },
               "outcome":{  
                  "type":"string"
               },
               "approvedOn":{  
                  "type":"array",
                  "items":{  
                     "type":"integer"
                  }
               }
            }
         },
         "required":[  
            "approvedOn",
            "approvedBy",
            "outcome"
         ]
      },
      "submittedOn":{  
         "type":"array",
         "items":{  
            "type":"integer"
         }
      },
      "createdBy":{  
         "type":"string"
      },
      "status":{  
         "type":"string"
      },
      "modifiedBy":{  
         "type":"string"
      },
      "attachments":{  
         "type":"array",
         "items":{  
            "type":"string"
         }
      },
      "notes":{  
         "type":"string"
      },
      "submittedBy":{  
         "type":"string"
      },
      "dayOfAbsences":{  
         "type":"array",
         "items":{  
            "type":"object",
            "id":"DayOfAbsence",
            "properties":{  
               "type":{  
                  "type":"string"
               },
               "date":{  
                  "type":"array",
                  "items":{  
                     "type":"integer"
                  }
               }
            }
         },
         "required":[  
            "date",
            "type"
         ]
      }
   },
   "required":[  
      "status",
      "submittedOn",
      "submittedBy"
   ]
}